{
  "$schema": "https://json-schema.org/draft/2020-12/schema",
  "$id": "https://asf.tmig/model/model-card.schema.json",
  "title": "ASF Model Card",
  "type": "object",
  "required": [
    "schema_version", "model_id", "model_version",
    "parameter_count", "modality", "context_window",
    "license", "substrate_descriptor", "capabilities",
    "evidence_obligations", "classification_ceiling"
  ],
  "properties": {
    "schema_version": { "const": "1.0" },
    "model_id": { "type": "string" },
    "model_version": { "type": "string" },
    "parameter_count": {
      "type": "object",
      "required": ["total"],
      "properties": {
        "total": { "type": "integer", "minimum": 1 },
        "active": { "type": ["integer", "null"] },
        "units": { "const": "parameters" }
      }
    },
    "modality": {
      "type": "array",
      "minItems": 1,
      "items": { "enum": ["text", "image", "audio", "video", "structured"] }
    },
    "context_window": {
      "type": "object",
      "required": ["tokens"],
      "properties": {
        "tokens": { "type": "integer", "minimum": 1 },
        "extension_mechanism": { "type": ["string", "null"] }
      }
    },
    "quantization": {
      "type": "object",
      "properties": {
        "supported": {
          "type": "array",
          "items": { "enum": ["fp16", "fp8", "int8", "int4"] }
        },
        "default": { "type": ["string", "null"] }
      }
    },
    "license": {
      "type": "object",
      "required": ["spdx", "commercial_use"],
      "properties": {
        "spdx": { "type": "string" },
        "commercial_use": { "type": "boolean" },
        "url": { "type": ["string", "null"] }
      }
    },
    "compute_budget": {
      "type": "object",
      "properties": {
        "training_flops": { "type": ["number", "null"] },
        "gpu_hours": { "type": ["number", "null"] },
        "hardware": { "type": ["string", "null"] },
        "inference_cost_model": {
          "type": ["object", "null"],
          "properties": {
            "cost_per_1k_input_tokens_usd": { "type": ["number", "null"] },
            "cost_per_1k_output_tokens_usd": { "type": ["number", "null"] }
          }
        }
      }
    },
    "substrate_descriptor": {
      "type": "object",
      "required": ["identity", "version", "provenance", "integrity", "lifecycle_state"],
      "properties": {
        "identity": { "type": "string" },
        "version": { "type": "string" },
        "provenance": { "type": "string" },
        "integrity": { "type": "string" },
        "lifecycle_state": {
          "enum": ["discovered", "registered", "qualified", "active", "retired"]
        }
      }
    },
    "capabilities": {
      "type": "array",
      "items": {
        "type": "object",
        "required": ["class", "supported"],
        "properties": {
          "class": {
            "enum": [
              "reasoning", "planning", "knowledge_access", "tool_use",
              "memory_access", "code_generation", "structured_output",
              "abstention", "uncertainty_reporting"
            ]
          },
          "supported": { "type": "boolean" },
          "detail": { "type": ["string", "null"] }
        }
      }
    },
    "anti_capabilities": {
      "type": "array",
      "items": {
        "enum": ["no_authority", "no_execution", "no_policy", "no_truth_certification", "no_silent_substitution"]
      },
      "default": ["no_authority", "no_execution", "no_policy", "no_truth_certification", "no_silent_substitution"]
    },
    "evidence_obligations": {
      "type": "array",
      "minItems": 1,
      "items": {
        "type": "object",
        "required": ["claim", "source"],
        "properties": {
          "claim": { "type": "string" },
          "source": { "type": "string" },
          "integrity_required": { "type": "boolean", "default": true }
        }
      }
    },
    "classification_ceiling": {
      "enum": ["unclassified", "internal", "confidential", "secret"]
    },
    "deployment_profiles": {
      "type": "array",
      "items": {
        "type": "object",
        "required": ["profile"],
        "properties": {
          "profile": { "enum": ["M", "L", "S", "E", "G"] },
          "serving_pattern": {
            "type": ["string", "null"],
            "enum": ["aggregated", "aggregated_router", "disaggregated", null]
          },
          "quantization": { "type": ["string", "null"] }
        }
      }
    }
  }
}
